{
  "$schema": "/schemas/release-manifest-v1.schema.json",
  "schemaVersion": 1,
  "product": "LaTeXSnipper Desktop",
  "version": "3.2.0",
  "channel": "LTS",
  "publishedAt": "2026-10-26T15:08:58Z",
  "releaseNotesUrl": "https://github.com/SakuraMathcraft/LaTeXSnipper/releases/tag/v3.2.0",
  "assets": [
    {
      "id": "linux-amd64-cpu",
      "platform": "linux",
      "label": "Linux",
      "architecture": "x86_64",
      "requirements": "Linux x86_64 便携包（tar.xz）；可选依赖环境需要 Python >=3.10,<3.13",
      "href": "/dl/LaTeXSnipper_3.2.0_linux_x86_64_cpu.tar.xz",
      "sha256": "8103535806a1098db7fb6ff2cc6ec0359ad630bc0221768f9afc27a22f8b638a",
      "size": "543.7 MB",
      "edition": "cpu"
    },
    {
      "id": "macos-arm64-cpu",
      "platform": "macos",
      "label": "macOS",
      "architecture": "Apple Silicon",
      "requirements": "macOS 11 或更高版本；截图需屏幕录制权限；可选依赖环境需要 Python >=3.10,<3.13",
      "href": "/dl/LaTeXSnipper_3.2.0_macos_arm64_cpu.dmg",
      "sha256": "daba3e755889764a7140db5c32b98f1bd52fc8c82286c099862f3bcdaf4265fe",
      "size": "623.2 MB",
      "edition": "cpu"
    },
    {
      "id": "windows-x86_64-cpu",
      "platform": "windows",
      "label": "Windows",
      "architecture": "x86_64",
      "requirements": "Windows 10 / 11",
      "href": "/dl/LaTeXSnipper_3.2.0_windows_x86_64_cpu.exe",
      "sha256": "a53e7e38d78b3612f4088742a11f0da7cbf33ffd120f51aba0d4f1c129f4e000",
      "size": "413.1 MB",
      "edition": "cpu"
    },
    {
      "id": "linux-amd64-gpu",
      "platform": "linux",
      "label": "Linux",
      "architecture": "x86_64",
      "requirements": "Linux x86_64 便携包（tar.xz）；可选依赖环境需要 Python >=3.10,<3.13",
      "href": "/dl/LaTeXSnipper_3.2.0_linux_x86_64_gpu.tar.xz",
      "sha256": "953e0ca7544ecb97297d13586908329b3f4336db11ad4353cb14da4064c7a824",
      "size": "1.9 GB",
      "edition": "gpu"
    },
    {
      "id": "office-plugin-windows",
      "platform": "windows",
      "label": "Desktop 内置 Office 插件",
      "architecture": "x86_64",
      "requirements": "Windows Word / PowerPoint；与 Desktop 同属 SakuraMathcraft/LaTeXSnipper",
      "href": "/dl/LaTeXSnipperOffice_3.2.0_amd64.exe",
      "sha256": "a96c3c78c1ccfcc56fd5a24980ac94cbf59aee652e6ccfe91bdff4e69f36b08f",
      "size": "7.2 MB"
    },
    {
      "id": "windows-x86_64-gpu",
      "platform": "windows",
      "label": "Windows",
      "architecture": "x86_64",
      "requirements": "Windows 10 / 11",
      "href": "/dl/LaTeXSnipper_3.2.0_windows_x86_64_gpu.exe",
      "sha256": "fef2f3ccbb539a641312607b29f1ca9a6a0c3612575dfc4dc14555ee18b32413",
      "size": "1.6 GB",
      "edition": "gpu"
    }
  ]
}
