{
  "$schema": "/schemas/release-manifest-v1.schema.json",
  "schemaVersion": 1,
  "product": "LaTeXSnipper Desktop",
  "version": "3.0.0",
  "channel": "LTS",
  "publishedAt": "2026-09-04T03:24:41Z",
  "releaseNotesUrl": "https://github.com/SakuraMathcraft/LaTeXSnipper/releases/tag/v3.0.0-LTS",
  "assets": [
    {
      "id": "windows-x86_64",
      "platform": "windows",
      "label": "Windows",
      "architecture": "x86_64",
      "requirements": "Windows 10 / 11",
      "href": "/dl/LaTeXSnipperSetup-3.0.0.exe",
      "sha256": "d5dfb1abc40f2cbab479dda1eb2cc6cdb1dd1e54887473e05083c2b2cfc68574",
      "size": "121.2 MB"
    },
    {
      "id": "linux-amd64",
      "platform": "linux",
      "label": "Linux",
      "architecture": "x86_64",
      "requirements": "Debian / Ubuntu 及兼容发行版；可选依赖环境需要 Python >=3.10,<3.13",
      "href": "/dl/LaTeXSnipper_3.0.0_amd64.deb",
      "sha256": "b0ca9bd6ddeea477e3980399b4dc8eec7c6e76c632ea9af17448669189d19ae5",
      "size": "175.6 MB"
    },
    {
      "id": "macos-arm64",
      "platform": "macos",
      "label": "macOS",
      "architecture": "Apple Silicon",
      "requirements": "macOS 11 或更高版本；截图需屏幕录制权限；可选依赖环境需要 Python >=3.10,<3.13",
      "href": "/dl/LaTeXSnipper_3.0.0_arm64.dmg",
      "sha256": "d90a40f8f0439c87a63cc6d3291493c2fb84810fdb35c6df98022d39c9b9975f",
      "size": "196.1 MB"
    },
    {
      "id": "office-plugin-windows",
      "platform": "windows",
      "label": "Desktop 内置 Office 插件",
      "architecture": "x86_64",
      "requirements": "Windows Word / PowerPoint；与 Desktop 同属 SakuraMathcraft/LaTeXSnipper",
      "href": "/dl/OfficePluginSetup-3.0.0.exe",
      "sha256": "2a260b925205200491958185cefaeb9028149f28bfac196da80aad682125e3f9",
      "size": "7.0 MB"
    }
  ]
}
